Filename,Segment,WC,Sixltr,negate,insight,cause,discrep,tentat,certain,inhib,incl,excl
"Scoresby v. Santillan, 346 S.W.3d 546.txt",1,713,28.89,3.65,1.82,1.26,1.96,4.35,2.95,1.26,2.24,3.79
"Williams v. Taylor Seidenbach, Inc., 958 F.3d 341.txt",1,673,22.73,2.82,2.23,1.63,1.63,2.82,1.63,0.89,3.12,2.67
"City of Dallas v. Martin, 361 S.W.3d 560.txt",1,73,27.40,0.00,5.48,2.74,2.74,1.37,0.00,0.00,1.37,1.37
"Mid-Continent Ins. Co. v. Liberty Mut. Ins. Co., 236 S.W.3d 765.txt",1,888,30.29,1.58,3.72,2.36,2.36,3.49,1.80,3.15,4.62,3.15
"E. Tex. Salt Water Disposal Co. v. Werline, 307 S.W.3d 267.txt",1,879,26.51,2.16,1.37,2.39,1.48,3.19,1.25,2.05,3.07,3.53
"City of Houston v. Carlson, 451 S.W.3d 828.txt",1,170,28.24,0.59,1.76,0.59,0.59,2.35,0.59,1.18,1.76,1.76
"Reid Rd. Mun. Util. Dist. No. 2 v. Speedy Stop Food Stores, Ltd., 337 S.W.3d 846.txt",1,478,31.80,2.09,2.09,1.05,2.09,3.97,1.26,3.97,2.93,5.02
"City of Dallas v. Albert, 354 S.W.3d 368.txt",1,553,28.75,2.71,4.70,2.17,2.35,4.52,3.44,0.90,3.44,5.24
"Sommers v. Sandcastle Homes, Inc., 521 S.W.3d 749.txt",1,3975,29.38,1.21,6.36,1.99,1.23,2.21,1.33,0.88,2.82,2.74
"Hoskins v. Hoskins, 497 S.W.3d 490.txt",1,394,31.98,2.28,2.54,1.78,0.25,3.05,1.78,3.81,4.57,2.79
"In the Interest of J.O.A., 283 S.W.3d 336.txt",1,401,30.92,0.75,2.00,2.24,1.50,4.24,1.25,2.99,3.24,2.49
"UDR Tex. Props., L.P. v. Petrie, 517 S.W.3d 98.txt",1,1690,27.69,1.01,5.50,3.49,1.83,4.67,1.95,2.31,3.37,3.20
"Patel v. Tex. Dep't of Licensing & Regulation, 469 S.W.3d 69.txt",1,11111,32.54,1.79,2.60,2.51,1.40,2.12,2.04,2.18,3.37,2.83
"Klein v. Hernandez, 315 S.W.3d 1.txt",1,1054,30.55,1.61,3.42,2.56,1.90,3.42,3.32,1.71,4.55,4.36
"Tex. Mut. Ins. Co. v. Ruttiger, 381 S.W.3d 430.txt",1,1075,30.51,1.21,3.07,2.60,1.12,1.58,2.60,1.30,4.19,2.79
"In re Caballero, 272 S.W.3d 595.txt",1,667,29.99,1.20,1.35,2.10,2.40,2.40,0.75,2.10,4.20,4.20
"Marsh USA Inc. v. Cook, 2011 Tex. LEXIS 465.txt",1,2694,31.07,1.56,2.38,2.34,1.26,2.08,2.45,3.16,3.79,2.86
"Collins v. Mnuchin, 938 F.3d 553.txt",1,10790,31.33,1.32,1.98,1.62,1.01,2.62,1.46,3.02,4.12,2.87
"Smith v. O'Donnell, 288 S.W.3d 417.txt",1,2449,28.91,1.59,1.80,1.67,2.82,2.25,1.71,2.12,3.59,2.57
"In the Interest of M.N., 262 S.W.3d 799.txt",1,273,34.43,1.47,2.20,1.83,1.47,3.30,1.10,2.56,3.30,3.30
"Coastal Oil & Gas Corp. v. Garza Energy Trust, 268 S.W.3d 1.txt",1,5754,31.00,1.51,1.67,3.35,2.09,1.88,2.22,0.99,4.78,2.33
"In re ADM Investor Servs., 304 S.W.3d 371.txt",1,1166,30.70,1.72,3.09,1.54,3.09,3.34,2.40,1.29,3.34,3.34
"Cadena Comercial USA Corp. v. Tex. Alcoholic Bev. Comm'n, 518 S.W.3d 318.txt",1,12187,33.44,1.61,2.22,3.09,1.39,2.99,1.75,2.42,3.58,2.93
"Ojo v. Farmers Group, Inc., 356 S.W.3d 421.txt",1,5779,30.85,1.71,4.38,2.68,1.28,2.60,2.77,0.81,4.08,2.80
"SEIU, Local 5 v. Prof'l Janitorial Serv. of Houston, Inc., 481 S.W.3d 210.txt",1,1478,32.14,2.03,3.18,1.22,1.35,3.04,1.29,1.22,5.21,3.38
"Marsh United States, Inc. v. Cook, 354 S.W.3d 764.txt",1,2694,31.07,1.56,2.38,2.34,1.26,2.08,2.45,3.16,3.79,2.86
"Hall v. McRaven, 508 S.W.3d 232.txt",1,4110,32.92,1.34,3.87,2.12,0.71,1.95,1.78,1.80,4.28,2.19
"Entergy Gulf States, Inc. v. Summers, 282 S.W.3d 433.txt",1,11892,32.69,1.87,2.62,2.30,1.52,2.72,2.07,1.08,3.68,3.78
"Matthews v. Kountze Indep. Sch. Dist., 484 S.W.3d 416.txt",1,2768,28.97,1.34,1.77,1.48,0.90,1.77,1.48,1.95,2.60,2.10
"Tex. Mut. Ins. Co. v. Ruttiger, 2011 Tex. LEXIS 600.txt",1,149,31.54,1.34,3.36,1.34,1.34,2.01,2.68,1.34,2.01,3.36
"Lewis v. Funderburk, 253 S.W.3d 204.txt",1,1141,25.85,3.24,1.67,1.31,1.49,2.02,1.93,1.67,2.80,2.72
"Cole v. Carson, 935 F.3d 444.txt",1,857,35.59,2.57,2.22,2.10,2.22,1.75,3.27,0.82,1.98,2.80
"Perry Homes v. Cull, 258 S.W.3d 580.txt",1,504,26.19,2.58,3.17,1.98,0.20,3.37,0.99,0.99,4.17,3.37
"In re State, 489 S.W.3d 454.txt",1,1954,27.38,2.30,2.00,1.48,1.23,1.74,3.33,1.43,3.68,1.79
"In re Watkins, 279 S.W.3d 633.txt",1,1891,26.39,3.12,1.85,1.43,1.69,2.96,1.75,1.64,3.07,3.28
"In re Pirelli Tire, L.L.C., 247 S.W.3d 670.txt",1,1815,30.14,2.09,2.31,1.82,1.71,2.31,1.87,1.21,3.64,2.81
"AHF-Arbors at Huntsville I, LLC v. Walker County Appraisal Dist., 410 S.W.3d 831.txt",1,1591,31.11,1.63,2.07,2.83,3.08,3.08,1.70,3.14,3.14,3.27
"Harris Cnty. Flood Control Dist. v. Kerr, 485 S.W.3d 1.txt",1,7217,29.96,1.68,1.72,3.41,1.68,1.93,1.87,1.18,2.51,2.38
"In re Allcat Claims Serv., L.P., 356 S.W.3d 455.txt",1,662,30.06,3.47,2.57,2.27,0.60,3.02,0.60,1.81,3.17,4.08
"Watson v. Newman, 299 S.W.3d 129.txt",1,457,36.32,0.22,1.53,1.31,1.31,1.31,1.09,5.47,3.94,1.75
"State v. One (1) 2004 Lincoln Navigator, 494 S.W.3d 690.txt",1,2925,29.71,1.23,3.59,2.50,1.44,2.36,1.44,1.06,3.35,2.60
"In re Nestle USA, Inc., 387 S.W.3d 610.txt",1,160,40.00,3.12,3.12,2.50,1.25,1.25,1.25,1.88,2.50,4.38
"State v. Naylor, 466 S.W.3d 783.txt",1,1323,22.90,2.57,1.44,1.97,1.06,3.85,1.21,2.12,3.48,4.08
"Lubbock County Water Control v. Church & Akin, L.L.C., 442 S.W.3d 297.txt",1,2197,29.45,1.68,1.96,4.05,1.82,1.82,1.73,2.23,3.23,2.78
"Severance v. Patterson, 370 S.W.3d 705.txt",1,193,32.12,2.59,3.63,1.04,1.04,3.63,4.15,1.04,2.07,3.11
"Loaisiga v. Cerda, 379 S.W.3d 248.txt",1,1019,26.59,2.26,3.04,1.96,2.55,1.96,1.47,1.77,2.16,3.43
"In re Bazan, 251 S.W.3d 39.txt",1,2443,29.19,1.88,3.03,1.68,0.94,2.05,2.58,1.68,3.19,3.44
"Nueces County v. Ballesteros, 347 S.W.3d 231.txt",1,170,32.94,0.00,3.53,2.35,0.59,1.18,0.59,2.94,3.53,0.59
"Ogletree v. Matthews, 262 S.W.3d 316.txt",1,862,28.89,2.20,1.62,2.32,1.28,3.60,3.25,1.62,2.90,3.02
"Jaster v. Comet II Constr., Inc., 438 S.W.3d 556.txt",1,1730,33.24,1.91,3.29,3.47,1.62,3.53,1.79,1.97,4.05,3.76
"Collins v. Mnuchin, 896 F.3d 640.txt",1,5847,30.55,1.28,1.66,1.32,1.11,2.43,1.93,4.21,4.72,2.36
"Roccaforte v. Jefferson County, 341 S.W.3d 919.txt",1,1284,27.49,1.64,4.44,3.35,2.49,2.57,2.10,2.41,2.65,4.21
"Univ. of Tex. at Arlington v. Williams, 459 S.W.3d 48.txt",1,3221,29.09,1.92,2.11,2.95,1.30,1.71,1.61,1.15,3.76,2.70
"City of Rockwall v. Hughes, 246 S.W.3d 621.txt",1,3018,31.94,1.79,2.88,2.72,2.05,2.65,1.99,1.69,2.88,3.21
"City of Galveston v. State, 217 S.W.3d 466.txt",1,2572,29.94,1.94,1.59,1.67,0.93,1.71,2.06,1.71,3.54,3.07
"AIC Mgmt. v. Crews, 246 S.W.3d 640.txt",1,401,34.41,1.25,3.74,1.75,2.00,3.24,3.49,1.25,4.49,4.24
"In re XL Specialty Ins. Co., 373 S.W.3d 46.txt",1,233,30.47,1.29,3.86,1.29,2.15,6.01,3.00,0.86,3.43,4.29
"Episcopal Diocese of Fort Worth v. Episcopal Church, 422 S.W.3d 646.txt",1,2929,27.89,1.91,2.42,2.90,1.57,3.11,1.81,1.74,2.97,3.55
"In re Bexar County Crim. Dist. Attorney's Office, 224 S.W.3d 182.txt",1,493,35.70,1.01,2.23,3.04,2.64,2.43,2.84,1.22,5.68,1.62
"In re Morgan Stanley & Co., 293 S.W.3d 182.txt",1,243,32.92,2.06,3.29,3.29,1.65,2.06,1.65,1.23,2.88,2.88
"Edwards Aquifer Auth. v. Chem. Lime, Ltd., 291 S.W.3d 392.txt",1,1629,29.47,1.53,4.05,2.33,1.23,2.82,1.35,0.68,4.24,2.64
"AIG Aviation, Inc. v. Holt Helicopters, Inc., 248 S.W.3d 169.txt",1,383,37.34,1.83,2.61,2.09,3.13,2.09,0.78,2.61,5.74,3.13